"Fecha","Título","Url"
2016-09-05,"Transformación digital de las AA.PP. en Andalucía","http://www.ctpdandalucia.es/es/content/transformacion-digital-de-las-aapp-en-andalucia"
2016-09-02,"Congreso internacional de transparencia organizado por la Universidad Complutense de Madrid","http://www.ctpdandalucia.es/es/content/congreso-internacional-de-transparencia-organizado-por-la-universidad-complutense-de-madrid"
2016-09-02,"Seminario de investigación - Forma de gobierno y aspectos institucionales de la participación en los sistemas de gobierno multinivel","http://www.ctpdandalucia.es/es/content/seminario-de-investigacion-forma-de-gobierno-y-aspectos-institucionales-de-la-participacion"
2016-09-02,"El Consejo de Transparencia y Protección de Datos de Andalucía participa en el III Congreso Internacional del avance del Gobierno Abierto / I Congreso de Buen Gobierno y Transparencia de la Comunitat Valenciana","http://www.ctpdandalucia.es/es/content/el-consejo-de-transparencia-y-proteccion-de-datos-de-andalucia-participa-en-el-iii-congreso"
2016-08-08,"Transparencia un instrumento contra la corrupción","http://www.ctpdandalucia.es/es/content/transparencia-un-instrumento-contra-la-corrupcion"
2016-08-08,"Profesionales del ámbito legislativo debaten en Almería sobre cómo acabar con la corrupción","http://www.ctpdandalucia.es/es/content/profesionales-del-ambito-legislativo-debaten-en-almeria-sobre-como-acabar-con-la-corrupcion"
2016-08-08,"El Director del Consejo ha participado en el Foro Mundial de Administración Pública","http://www.ctpdandalucia.es/es/content/el-director-del-consejo-ha-participado-en-el-foro-mundial-de-administracion-publica"
2016-08-08,"Transparencia y Regeneración Democrática","http://www.ctpdandalucia.es/es/content/transparencia-y-regeneracion-democratica"
